{
  "accountAccessType": "example-value",
  "authentication": "example-value",
  "created": "example-value",
  "dataSources": "example-value",
  "description": "Example resource description",
  "endpoint": "example-value",
  "freeTrialConsumed": "example-value",
  "freeTrialExpiration": "example-value",
  "grafanaVersion": "example-value",
  "id": "abc12345",
  "licenseExpiration": "example-value",
  "licenseType": "example-value",
  "modified": "example-value",
  "name": "my-resource",
  "networkAccessControl": "example-value",
  "notificationDestinations": "example-value",
  "organizationRoleName": "my-resource",
  "organizationalUnits": "example-value",
  "permissionType": "example-value",
  "stackSetName": "my-resource",
  "status": "ACTIVE",
  "tags": "example-value",
  "vpcConfiguration": "example-value",
  "workspaceRoleArn": "arn:aws:service:us-east-1:123456789012:resource/id"
}